{
  "chapter_code": "HSP-C03",
  "code": "HSP-C03-LS-10",
  "content_version": "0.3.0-draft",
  "entity_type": "lesson-section",
  "id": "8d6b103f-1d48-50d9-afd1-958f17239964",
  "order": 10,
  "replaced_by": null,
  "replaces": null,
  "source_locator": {
    "artifact": "Hospitrainity.docx",
    "block_index": 322,
    "chapter": 3,
    "heading_path": [
      "Dealing with Customers on the Phone",
      "Step 7. Quiz"
    ],
    "normalized_text_sha256": "9c5b48740d8895bfd79c67e523b811471e0f8d2e32fc6b1be003e11c4c91c008"
  },
  "status": "published",
  "title": "Step 7. Quiz"
}
