{
  "chapter_code": "HSP-C03",
  "code": "HSP-C03-LS-11",
  "content_version": "0.3.0-draft",
  "entity_type": "lesson-section",
  "id": "804d6167-a936-5029-9c59-f2925106c950",
  "order": 11,
  "replaced_by": null,
  "replaces": null,
  "source_locator": {
    "artifact": "Hospitrainity.docx",
    "block_index": 348,
    "chapter": 3,
    "heading_path": [
      "Dealing with Customers on the Phone",
      "Step 8. Confidence check"
    ],
    "normalized_text_sha256": "de3541b7e7f4f5aff977a439df59ffbf2a304ff6fc9152f1e6f7a6991667643c"
  },
  "status": "published",
  "title": "Step 8. Confidence check"
}
